Key,Id,English(en),Portuguese(pt),Russian(ru),Spanish(es)
Name,2861854732288,Foxy,Foxy,Фокси ,Foxy
Hints/Level 1/Standard,2861871509504,"To avoid being caught by Foxy, pay attention to the sounds. If you hear a metallic sound, don't hesitate to hide. Avoid using light and prioritize hiding until Foxy finishes searching the room.","Para evitar ser pego pelo Foxy, preste atenção nos sons. Se você ouvir um som metálico, não hesite em se esconder. Evite usar luz e priorize se esconder até que Foxy termine de vasculhar o ambiente.","чтобы услышать  приход Фокси,прислушайтесь,если вы услышали металлический скрип спрячьтесь под столом пока он не уйдет. ","Para evitar ser atrapado por Foxy, presta atención a los sonidos, si escuchas un sonido metálico no dudes en esconderte. Evita iluminar y prioriza el esconderte asta que Foxy termine de buscar en la sala."
Hints/Level 1/Flashed,2861871509505,"Pay attention to the sounds to know if Foxy is lurking and avoid dazzling the hallway where it is located; otherwise, it will attack you instantly!","Preste atenção aos sons para saber se Foxy está à espreita e evite iluminar o corredor onde ele está; caso contrário, ele atacará você instantaneamente!","будьте аккуратны,если вы услышали Фокси в одном из проходов,не светите на него,иначе он вас незамедлительно убьет! ","Presta atención a los sonidos para saber si Foxy está acechando y evita deslumbrar el pasillo donde se encuentra, de lo contrario, ¡te atacará al instante!"
Hints/Level 1/Posters,2861871509506,Foxy hates the sound of the posters.,Foxy odeia o som dos pôsteres,фокси не любит звук постеров. ,Foxy odia el sonido de los carteles.
Hints/Level 4/Standard,6572640832569344,"To avoid Foxy, you need to hide in the locker opposite to the side where he's going to open the door. You have a short reaction time before the door opens.","Para evitar Foxy, você precisa se esconder no armário oposto ao lado onde ele vai abrir a porta. Você tem um curto tempo de reação antes que a porta se abra.","чтобы спастись от фокси,вам нужно залезть в дальний шкаф параллельно двери и ждать пока он не уйдет. ","Para evitar a Foxy, necesitas esconderte en la taquilla contraria al lado donde va a abrir la puerta. Tienes poco tiempo de reacción antes de que abra la puerta."
Hints/Level 4/Hide,6572983503011840,You've hidden in the wrong locker. Foxy always checks the locker next to where he opens the door.,Você se escondeu no armário errado. Foxy sempre verifica o armário ao lado de onde ele abre a porta.,"вы спрятались в неверный шкаф.фокси всегда проверяет шкаф,который находится ближе к двери. ",Te has escondido en la taquilla incorrecta. Foxy siempre revisa la taquilla que está al lado de donde abre la puerta.
