Key,Id,English(en),Portuguese(pt),Russian(ru),Spanish(es)
"Tutorials/Screen 0",1009096437760,"Charge the batteries from the computer",,,"Carga las baterías desde el ordenador"
"Tutorials/Screen 1",1009117409280,"Prevent the door's health from reaching 0",,,"Evita que la salud de la puerta llegue a 0"
"Tutorials/Screen 2",1009117409281,"Watch the halls",,,"Vigila los pasillos"
"Tutorials/Screen 3",1009117409282,"Good luck
",,,"Buena suerte"
"Tips/UsePC",1009117409283,"You can use the PC by <sprite=""Right Click"" name=""Right Click""> on it.",,,"Puedes usar el PC haciendo <sprite=""Right Click"" name=""Right Click""> en él."
"Tips/Batteries",1009117409284,"Charge the batteries by holding the ""Charge"" button",,,"Carga las baterías manteniendo pulsado el botón ""Cargar"""
"Mobile/Tips/UsePC",1009117409285,"You can use the PC by touching it.",,,"Puedes usar el PC tocándolo."